<?xml version="1.0" encoding="UTF-8"?>
<zah:zahtev xmlns:zah="www.rokzasok.rs/gradjanin/zahtev-za-sertifikat"
    xmlns:xsi="http://www.w3.org/2001/XMLSchema-instance"
    xsi:schemaLocation="www.rokzasok.rs/gradjanin/zahtev-za-sertifikat  schema/zahtev_za_sertifikat.xsd">
    <zah:razlog_podnosenja>Odlazak u kafic</zah:razlog_podnosenja>
    <zah:mesto>Novi Sad</zah:mesto>
    <zah:datum>2021-10-10</zah:datum>
    <zah:pacijent>
        <zah:jmbg>1702998158969</zah:jmbg>
        <zah:ime>Nikola</zah:ime>
        <zah:prezime>Anic</zah:prezime>
        <zah:pol>M</zah:pol>
        <zah:datum_rodjenja>1998-12-12</zah:datum_rodjenja>
        <zah:broj_pasosa>1234567890</zah:broj_pasosa>
    </zah:pacijent>
    <zah:dokument_id>1234567890</zah:dokument_id>
</zah:zahtev>