<?xml version="1.0" encoding="UTF-8"?>
<zh:zahtev xmlns:zh="www.rokzasok.rs/gradjanin/zahtev-za-sertifikat"
           xmlns:tp="http://www.rokzasok.rs/tipovi"
           xmlns="http://www.w3.org/ns/rdfa#"
           xmlns:pred="http://www.rokzasok.rs/rdf/database/predicate/"
           xmlns:xsi="http://www.w3.org/2001/XMLSchema-instance"
           xsi:schemaLocation="www.rokzasok.rs/gradjanin/zahtev-za-sertifikat schema/zahtev_za_sertifikat.xsd"
           vocab="http://www.rokzasok.rs/rdf/database/predicate"
           about="http://www.rokzasok.rs/rdf/database/zahtev-za-sertifikat/1" rel="pred:kreiranOdStrane"
           xmlns:xs="http://www.w3.org/2001/XMLSchema"
           href="http://www.rokzasok.rs/rdf/database/osoba/1702998158969"
>
    <zh:razlog_podnosenja datatype="xs:string" property="pred:razlogPodnosenja">Odlazak u kafic</zh:razlog_podnosenja>
    <zh:mesto property="pred:mestoPodnosenja" datatype="xs:string">Novi Sad</zh:mesto>
    <zh:datum datatype="xs:date" property="pred:datumPodnosenja">2021-10-10</zh:datum>
    <zh:pacijent idPacijenta="1" about="http://www.rokzasok.rs/rdf/database/osoba/1702998158969" vocab="http://www.rokzasok.rs/rdf/database/predicate">
        <zh:jmbg>1702998158969</zh:jmbg>
        <zh:ime>Nikola</zh:ime>
        <zh:prezime>Anic</zh:prezime>
        <zh:pol>M</zh:pol>
        <zh:datum_rodjenja>1998-12-12</zh:datum_rodjenja>
        <zh:broj_pasosa>1234567890</zh:broj_pasosa>
    </zh:pacijent>
    <zh:dokument_id>50</zh:dokument_id>
</zh:zahtev>
